{
  "$schema": "https://json-schema.org/draft/2020-12/schema",
  "title": "CAWS Lite Scope Configuration",
  "description": "Scope configuration for CAWS lite mode — guardrails without YAML specs. This schema governs the standalone .caws/scope.json file ONLY; inline scope: blocks inside feature specs under .caws/specs/ are governed by the feature-spec schema's scope sub-schema and do NOT invoke this schema. See CAWSFIX-11.",
  "type": "object",
  "required": ["allowedDirectories"],
  "properties": {
    "version": {
      "type": "integer",
      "const": 1,
      "description": "Schema version. Optional for back-compat with scope.json files that predate versioning; the runtime (src/config/lite-scope.js) defaults to 1 when missing. If present, must be exactly 1. CAWSFIX-11 lifted `version` from the required list because no code path enforces a version mismatch — only the schema did, producing spurious warnings for pre-versioning scope.json files."
    },
    "allowedDirectories": {
      "type": "array",
      "items": { "type": "string" },
      "minItems": 1,
      "description": "Directories the agent is allowed to modify (e.g., src/, tests/)"
    },
    "bannedPatterns": {
      "type": "object",
      "properties": {
        "files": {
          "type": "array",
          "items": { "type": "string" },
          "description": "Glob patterns for banned file names (e.g., *-enhanced.*, *-final.*)"
        },
        "directories": {
          "type": "array",
          "items": { "type": "string" },
          "description": "Glob patterns for banned directory names (e.g., *venv*, .venv)"
        },
        "docs": {
          "type": "array",
          "items": { "type": "string" },
          "description": "Glob patterns for banned doc file names (e.g., *-summary.md)"
        }
      },
      "additionalProperties": false
    },
    "maxNewFilesPerCommit": {
      "type": "integer",
      "minimum": 1,
      "maximum": 100,
      "description": "Maximum number of new files allowed per commit (prevents file sprawl)"
    },
    "designatedVenvPath": {
      "type": "string",
      "description": "The only allowed virtual environment path (e.g., .venv)"
    }
  },
  "additionalProperties": false
}
